image_id,caption
305609,"The image features a dining table filled with a variety of breakfast foods. There are several plates containing different types of food, including waffles, toast, and bacon. A person is sitting at the table, enjoying the meal.

In addition to the food, there are multiple utensils on the table, such as forks, knives, and spoons. There are also two bowls placed on the table, one near"
306582,"The image features a group of cows standing in a field, with some of them hanging out their clothes. There are at least five cows in the scene, with some of them wearing clothes, while others are not. The cows are scattered throughout the field, with some closer to the foreground and others further in the background. The scene is set in a rural area, with a wooden structure nearby."
308799,"The image showcases a large, modern kitchen with black cabinets and stainless steel appliances. The kitchen features a stove top oven, a refrigerator, and a microwave. There is also a sink in the kitchen area.

Various items can be seen on the countertops, including a bottle, a cup, a bowl, and a spoon. The kitchen is well-equipped and ready for cook"
309484,"The image features a dog with a toothbrush in its mouth, being brushed by a person. The dog is lying on a bed, and the person is standing nearby, attending to the dog's dental hygiene. The scene is quite playful, as the toothbrush appears to be a toy, adding a lighthearted touch to the moment."
311950,"The image features a hot dog with mustard and ketchup, placed on a table. The hot dog is the main focus of the scene, with the condiments spreading across the bun. The table is covered with a colorful confetti, adding a festive touch to the presentation. The hot dog is positioned in the center of the table, surrounded by the vibrant confetti."
312263,"The image features a tall brick building with a clock mounted on the side. The clock is positioned near the top of the building, making it easily visible. The building is situated in a city, and its architectural details, such as the clock, contribute to the overall aesthetic."
312406,"The image features a dining table with a variety of food items. There are two bananas, one placed near the left edge of the table and the other closer to the center. A can of coconut powder is also present on the table, located towards the right side.

In addition to the food items, there is a spoon placed near the right edge of the table, and a bowl is situated towards the right side of the table. The"
313454,"The image features a man standing at a podium, giving a presentation. He is wearing a suit and tie, and there are several chairs placed around the room. In addition to the chairs, there are two potted plants in the room, one near the left side and the other near the right side.

A few wine glasses are scattered around the room, with one near the center, another on the right side, and the third one on the"
317999,"The image features a man and a young girl sitting together on a bed. The man is wearing glasses and has a beard, while the little girl is holding a book. They seem to be enjoying their time together, possibly reading a story or sharing a bonding moment.

The bed occupies the majority of the scene, with the man and the girl sitting on opposite sides. The girl is positioned more towards the right side of the bed, while"
319935,"The image showcases a spacious and well-lit living room with a large window. The room features a comfortable bed, a couch, and a chair, all arranged to create a cozy atmosphere. A television is mounted on the wall, providing entertainment for the occupants.

In addition to the furniture, there are several potted plants placed throughout the room, adding a touch of greenery to the space. A book can be seen on one"
320696,"The image captures a man skillfully riding a surfboard on a wave in the ocean. He is wearing a wetsuit, which is visible as he skillfully navigates the water. The surfer is in the middle of the wave, showcasing his talent and balance. The scene is dynamic, with the man and the surfboard being the main focus of the image."
321214,"The image features a young child sitting at a dining table, eating a piece of cake. The child is focused on the cake, which is placed in front of them. The table is surrounded by chairs, with one chair located on the left side of the table and another on the right side. The scene is set in a cozy and comfortable environment."
322610,"The image depicts a busy city street with several people walking down the sidewalk. Among the pedestrians, a woman is sitting on a bench, holding an umbrella to shield herself from the elements. Another person is also holding an umbrella, possibly for the same reason.

There are multiple handbags visible in the scene, with one near the woman sitting on the bench, another close to the person walking, and the third"
323709,"The image features a large white airplane parked on the runway at an airport. The airplane is positioned in the middle of the scene, with its wings visible. The airport is located near a forest, which can be seen in the background.

In addition to the airplane, there are two people in the scene. One person is standing near the left side of the airplane, while the other person is located closer to the right side."
324258,"The image features two men standing in a living room, playing a video game together. One of the men is holding a Wii remote, while the other is holding a bottle. They are both engaged in the game, enjoying their time together.

The living room is furnished with a couch located in the background, and a chair placed nearby. There are several books scattered around the room, possibly indicating the interests of the occupants. A laptop can also"
325031,"The image features a large white elephant statue in a park, surrounded by a crowd of people. The elephant statue is the main focus of the scene, with its intricate design and impressive size.

There are numerous people scattered throughout the park, admiring the elephant statue and enjoying the outdoor setting. Some individuals are closer to the elephant, while others are further away, creating a lively atmosphere in the park."
325838,"The image features a woman sitting at a table, using a laptop computer. She is surrounded by several laptops, with one placed in front of her and others on the table. A mouse is also visible on the table, close to the laptop she is using.

The room has a few chairs, one near the woman and another further away. There is a TV mounted on the wall, and a cell phone can be seen placed on the table. The scene"
326174,"The image features a group of people, including both adults and children, walking along the beach while holding surfboards. There are at least nine people in the scene, with some of them carrying surfboards. The surfboards come in various sizes and are being held by the individuals.

The beach is a lively place, with people enjoying their time near the water. The atmosphere is lively, and the group seems to be having a great time"
327306,"The image features a skateboarder performing a trick on a cement ledge. The skateboarder is captured in mid-air, showcasing their skill and balance. The skateboard is visible beneath the skateboarder, adding to the dynamic nature of the scene. The image is in black and white, giving it a classic and timeless feel."
328601,"The image features a man in a grey shirt and grey pants, holding a tennis racket and preparing to hit a tennis ball. He is in the middle of a swing, demonstrating his skill in the sport. The tennis ball is in the air, close to the man, as he focuses on his shot. The scene is set on a tennis court, with the man being the main subject of the image."
329455,"The image features a large pizza placed on a wooden table, taking up a significant portion of the table's surface. The pizza is topped with pepperoni, making it an appetizing sight. 

There are two people in the scene, one on the left side and the other on the right side of the table. They are seated at the table, likely enjoying the pizza together. In addition to the pizza, there are"
331075,"The image features a dog standing on a beach, with its tongue out, possibly enjoying the water. The dog is wearing a collar, and it appears to be a black and white dog. The beach is a lively scene with the dog being the main focus."
331317,"The image features a large, ornate clock mounted on the wall of a building. The clock is prominently displayed, with its face visible from various angles. The clock's design is reminiscent of a church clock, adding a sense of grandeur to the scene. The building's architecture is also visible, with the clock being a focal point in the space."
334371,"The image depicts a busy city street with multiple buses driving down the road. There are at least four buses visible in the scene, with one bus located near the left side of the image, another bus in the middle, and two more buses on the right side.

A person is standing on the sidewalk, possibly waiting for a bus or observing the traffic. There are also two traffic lights in the scene, one near the left side and"
335328,"The image features a man and a young boy enjoying a day at the beach. The man is wearing a wetsuit, while the boy is wearing a black wetsuit. They are both riding surfboards in the ocean, with the man on the left side of the image and the boy on the right side.

The waves are relatively small, providing a safe and fun environment for the two surfers. The scene captures the essence"
338718,"The image features a street with a car driving down the road. The car is positioned towards the left side of the scene. There are two street signs lying on the ground, one near the center of the image and the other towards the right side. The street signs are likely damaged or broken, as they are not in their proper position."
342367,"The image is a television screen showing a man wearing a top hat and a black jacket, standing in front of a microphone. He appears to be giving a speech or participating in a debate. There are several other people in the scene, including a woman who is also wearing a hat.

In the background, there are two chairs, one located near the left side of the image and the other towards the right side. A laptop can be seen"
343934,"The image features a blue motorcycle parked in front of a building with graffiti on the walls. The motorcycle is positioned on the sidewalk, and it appears to be the main focus of the scene. The graffiti on the walls adds a vibrant and urban atmosphere to the setting."
344795,"The image features a microwave oven with a metal tray placed inside it. The tray is filled with a food item, possibly a cake, which is being heated. The food item is surrounded by aluminum foil, ensuring even cooking and preventing any spills. The microwave is turned on, and the food is being cooked, creating a warm and inviting atmosphere."
345385,"The image features two men lying in bed together, with one man resting his head on the other's chest. They are both wearing black shirts, and the man on the right has a beard. The bed they are lying on is covered with a blanket, providing a cozy atmosphere. The scene appears to be a close and intimate moment between the two men."
346232,"The image depicts a lively scene of a group of people walking down a dirt road, possibly at a festival. There are at least 13 people visible in the scene, with some walking closer to the camera and others further away.

A colorful umbrella is open, providing shade for the people walking underneath it. The umbrella is located towards the right side of the scene. The people are carrying various items, such"
347265,"The image features a woman wearing a pink jacket, standing on a snowy trail surrounded by trees. She is holding ski poles and appears to be enjoying her time in the snowy forest. The woman is the main focus of the scene, with the trees and snowy trail providing a picturesque winter setting."
348216,"The image features a room with a row of five old-fashioned wooden bath tubs lined up against the wall. The tubs are arranged in a neat row, with each tub varying in size. The room appears to be a bathroom, and the tubs are likely used for bathing or relaxation. The overall atmosphere of the room is somewhat dark, giving it a somewhat eerie appearance."
350019,"The image features a young boy standing next to a suitcase, which is open and placed on the floor. The boy appears to be looking inside the suitcase, possibly preparing for a trip or organizing his belongings. The suitcase is positioned in the center of the scene, with the boy standing close to it."
350679,"The image features a bride and groom cutting a large, colorful wedding cake together. The bride is on the left side of the cake, while the groom is on the right side. They are both holding a knife, preparing to cut the cake.

In the background, there are several other people, likely guests attending the wedding. Some of them are standing close to the couple, while others are further away."
350833,"The image features a small, clean bathroom with a white toilet and a white bathtub. The toilet is located on the left side of the bathroom, while the bathtub is situated on the right side. The bathroom is equipped with a sink, which is placed on the left side of the room.

There are two toilet paper rolls in the bathroom, one located near the toilet and the other"
352760,"The image captures a skier in mid-air, performing a jump on a ski slope. The skier is wearing a yellow outfit, and their skis are clearly visible as they soar through the air. The skier's arms are outstretched, and their legs are slightly bent, showcasing their skill and control during the jump. The scene is set against a backdrop of a cloudy sky, adding to the excitement of the"
353096,"The image features a white computer monitor sitting on a desk. The monitor is turned on, displaying a blue screen with a lightning bolt streak. The desk is equipped with a keyboard and a mouse, both placed in front of the monitor.

In addition to the computer setup, there are two books on the desk, one located near the left side and the other near the right side. A cell phone can also be seen on the desk"
355817,"The image features a red, yellow, and black passenger bus driving down a street. The bus is quite large, occupying a significant portion of the scene. The street is lined with buildings on both sides, creating an urban atmosphere.

There are several people visible in the scene, with some standing near the bus and others scattered throughout the area. A car can also be seen parked on the left side of the street. The overall scene is bustling with"
358427,"The image features a close-up view of a piece of broccoli on a fork. The broccoli is placed on the fork, which is positioned on a dining table. The broccoli is the main focus of the image, with the fork and table in the background."
358923,"The image features a woman wearing a colorful umbrella hat, which is a unique and eye-catching accessory. She is talking on her cell phone while standing outside. There are several other people in the scene, some of whom are also engaged in conversations on their cell phones.

In the background, there is a car parked, and a handbag can be seen placed nearby. The overall atmosphere of the scene suggests a lively and"
360137,"The image features a woman standing on a cliff, holding a colorful umbrella to shield herself from the elements. She is wearing a blue shirt and is positioned near the edge of the cliff, overlooking the ocean. The umbrella is open, providing her with protection from the sun or rain. The woman appears to be enjoying her time by the water, taking in the beautiful view."
360661,"The image captures a thrilling moment during a horse race on the beach. Two jockeys are riding their horses, with one horse positioned closer to the left side of the image and the other horse located more towards the right side. The jockeys are wearing white and red outfits, adding to the excitement of the race.

In the background, there are several people watching the race, with some standing closer to the left side"
361238,"The image features a woman sitting at a dining table, smiling as she looks at a large pizza placed in front of her. The pizza is covered in various toppings, making it an appetizing sight.

The table is surrounded by chairs, with one chair on the left side of the table and another on the right side. There are also two potted plants in the room, one located near the top left corner and the other near the"
361571,"The image features a large white dog wearing a hat, standing in a grassy field. The dog appears to be smiling, possibly enjoying the outdoors. The dog's hat is brown, adding a unique touch to the scene. The dog is the main focus of the image, with the grassy field surrounding it."
362682,"The image features a blue and white bus driving down a street. The bus is adorned with a cat design, making it stand out from other vehicles. There are several people visible in the scene, with some standing close to the bus and others further away.

In addition to the bus, there is a car parked on the side of the street. A clock can be seen in the background, possibly indicating the time for the passengers. The overall atmosphere suggests a"
362716,"The image features a man dressed in a green shirt and hat, holding a tennis racket and preparing to hit a tennis ball. He is in the middle of a tennis match, focused on the ball and ready to make a move. The tennis ball is in the air, close to the man, as he is about to make contact with it."
363072,"The image features a train traveling down the tracks, with a large building in the background. The train is positioned in the middle of the scene, occupying a significant portion of the image. The tracks are visible, stretching from the left side to the right side of the image.

There are several people in the scene, with some standing close to the train and others further away. They appear to be observing the train as it passes by. The presence"
365098,"The image features a small boat floating on the water, with a person sitting inside. The boat is positioned in the middle of the scene, and the person appears to be enjoying the ride. The water appears to be calm, providing a serene atmosphere for the boat's journey."
368294,"The image features a man wearing a yellow shirt, sitting at a workbench and cutting a piece of paper with a pair of scissors. He is focused on his task, possibly working on a craft project or a piece of art.

The workspace is equipped with a few tools, including a knife and a cup. There are also two books in the scene, one located near the man and the other further away. The overall atmosphere suggests"
369081,"The image features a group of three brown horses running together in a grassy field. They are positioned in a line, with the first horse on the left, the second horse in the middle, and the third horse on the right. The horses appear to be enjoying their time in the open field."
370270,"The image features a group of people gathered in a kitchen, with one woman swinging a baseball bat at a ball. The scene appears to be a fun and lively gathering. 

There are several people in the room, with some standing closer to the woman swinging the bat, while others are positioned further away. A few cups can be seen placed around the kitchen, and a bowl is located near the center of the room. A cell phone"
370478,"The image features a room with a laptop placed on the floor, surrounded by various items. There are two suitcases, one located near the left side of the room and the other towards the right side. A backpack is also present in the room, situated close to the laptop.

In addition to the luggage, there are several books scattered throughout the room, with some placed on the floor and others on surfaces. A cup can be seen on the left side"
374083,"The image features a man and a young girl standing in a kitchen, preparing a cake together. The man is holding a knife, while the girl is pointing at the cake, possibly suggesting a design or decoration. The cake is placed on a dining table, which occupies a significant portion of the scene.

In the background, there is a refrigerator, a sink, and a microwave. Additionally, there are two"
374369,"The image features a person wearing a black jacket and a helmet, standing on a snow-covered slope. The person is holding ski poles and is likely preparing to ski down the hill. The skier is positioned in the middle of the scene, with the ski poles visible in their hands. The snowy landscape extends beyond the person, creating a picturesque winter scene."
376093,"The image depicts a group of people gathered around a dining table, enjoying a pizza party. There are at least six people in the scene, with some standing and others sitting. The table is filled with pizza, and there are multiple cups placed around the table, suggesting that the guests are drinking beverages as well.

In addition to the pizza, there are two bottles on the table, possibly containing beverages for"
376278,"The image features a zebra lying down on the ground, possibly resting or sleeping. The zebra is positioned in the middle of the scene, occupying a significant portion of the image.

In the background, there are two birds, one located on the left side of the image and the other on the right side. The birds appear to be perched on the ground, possibly observing the zebra or simply resting nearby."
376478,"The image features a glass vase filled with a single pink rose, placed on a wooden deck. The vase is positioned on the deck, and the rose is the main focus of the scene. The wooden deck provides a natural and rustic backdrop for the delicate flower arrangement."
377635,"The image captures a young man skillfully performing a trick on his skateboard at a skate park. He is in the air, flying through the air while riding the skateboard. There are several other people in the background, possibly watching the skateboarder or waiting for their turn to perform tricks.

In addition to the skateboarder, there are two bicycles in the scene, one located near the left side of the"
377723,"The image depicts a busy city street with a large blue and white bus parked on the side of the road. The bus is surrounded by a crowd of people, some of whom are standing close to the bus, while others are scattered throughout the scene.

There are several handbags visible in the image, with one near the center of the scene, another closer to the left side, and the third one located near the right side. The people in the"
378284,"The image features a delicious pizza with various toppings, including peppers, on a wooden table. The pizza is placed on a black tray, which is resting on a wooden table. The table is surrounded by chairs, with one chair located on the left side of the table and another chair on the right side.

In addition to the pizza, there is a knife placed on the table, likely used for cutting the pizza into"
378873,"The image features a bustling outdoor market filled with a variety of fresh fruits and vegetables. There are several people shopping and browsing the produce, with some standing close to the front of the market and others scattered throughout the scene.

The market is well-stocked with a wide assortment of items, including multiple apples, oranges, and carrots. The apples are found in various locations, while the oranges are"
383921,"The image features a herd of elephants gathered around a watering hole. There are at least nine elephants visible in the scene, with some standing closer to the water and others further away. The elephants are of various sizes, indicating a mix of adults and younger members of the herd.

The watering hole is located near a river, providing a natural source of water for the elephants. The scene captures the essence"
384808,"The image features a man standing in a bathroom, taking a picture of himself in the mirror. He is wearing a blue robe, and the bathroom appears to be well-equipped with a sink, toilet, and a shower.

There are several bottles scattered around the bathroom, with some placed near the sink and others near the toilet. Additionally, there is a toothbrush located close to the sink. The"
385190,"The image features a street with a large mural painted on the side of a building. The mural is quite colorful and captures the attention of passersby. There are several people walking along the street, with some closer to the mural and others further away.

In addition to the people, there are two bicycles parked on the sidewalk, one near the center of the scene and the other towards the right side. A traffic light can"
386352,"The image features a woman playing tennis, holding a tennis racket and preparing to hit the ball. She is the main focus of the scene, with her tennis racket in the middle of the action.

There are several other people in the background, possibly watching the game or waiting for their turn to play. Some of them are seated on chairs, while others are standing. The chairs are scattered around the area, with some placed close to the woman"
389197,"The image features a young boy riding a blue surfboard on a water slide. He is skillfully navigating the slide, enjoying the ride. The scene also includes several other people, some of whom are watching the boy, while others are engaged in their own activities.

In the background, there are a few more people, possibly waiting for their turn to ride the slide or simply enjoying the atmosphere. The presence of multiple people in the scene suggests a"
