image_id,caption
157046,"The image features a person holding a Wii remote, pointing it towards a television screen. The television screen displays a video game, possibly a game of Wii. The person is standing in front of the screen, fully engaged in the gaming experience.

In the background, there is a chair placed near the television, and a couch can be seen further back. The scene is set in a room where the person is enjoying their gaming session."
157418,"The image features a dining table with a variety of food items. There are two sandwiches, one placed towards the right side of the table and the other closer to the left side. A can of Spam is also present on the table, along with a bowl and a cup.

In addition to the main dishes, there are two carrots, one located near the center of the table and the other towards the right side. A knife"
157767,"The image depicts a lively gathering of people in a room, possibly at a convention or a similar event. There are at least 13 people in the scene, with some standing closer to the foreground and others further back.

A dining table is set up in the room, featuring a variety of food items such as sandwiches, pastries, and donuts. There are at least 11 sandwiches, 10"
158660,"The image features a dining table with a variety of fruits and pastries on display. There are several apples placed on the table, with some of them being green. In addition to the apples, there are bananas, a bowl of fruit, and a bowl of pastries.

A person is visible in the background, possibly attending to the food display or preparing the meal. The table is surrounded by chairs, with one"
161044,"The image features three small airplanes flying in formation through a cloudy sky. The planes are positioned close to each other, creating an impressive sight. The sky is filled with clouds, adding to the dramatic atmosphere of the scene. The airplanes are flying in a straight line, showcasing their coordination and skill."
162130,"The image features a wooden bench situated in a grassy field, surrounded by trees. The bench is positioned in the middle of the scene, providing a comfortable spot for visitors to sit and enjoy the natural surroundings. The field is spacious, with a few trees scattered throughout the area. The overall atmosphere is serene and inviting, making it an ideal location for relaxation and contemplation."
162858,"The image depicts a busy street filled with traffic, including cars, a bicycle, and a motorcycle. There are multiple traffic lights along the street, ensuring the smooth flow of traffic. The street is lined with trees, providing a pleasant atmosphere.

In the scene, there are several cars, with some positioned closer to the foreground and others further back. A bicycle is visible near the left side of the image, while a"
163290,"The image features a zebra and a giraffe standing together in an enclosure. The zebra is positioned on the left side of the scene, while the giraffe is on the right side. Both animals are standing close to each other, creating a sense of companionship.

The enclosure is surrounded by a fence, which separates the animals from the viewer. The zebra is eating from a feeder, which"
163640,"The image features a man standing in front of a food counter, holding up a piece of food, likely a donut, for the camera. Another person is visible in the background, possibly waiting for their order or observing the scene.

The food counter is equipped with a sink, which is located towards the right side of the image. There are also two bowls placed on the counter, one near the center and the other towards the right side. A back"
164637,"The image features a bathroom with a pink sink and a white toilet. The sink is situated under a mirror, which is mounted on the wall above the toilet. The bathroom also has a refrigerator, which is placed in the corner of the room.

There are two towels in the bathroom, one located near the sink and the other near the toilet. Additionally, there are two cups placed on the"
166563,"The image features a large elephant statue standing on its hind legs, with its trunk in its mouth. The elephant statue is positioned in front of a sign, possibly advertising a rental property. The scene is set in a black and white photo, giving it a vintage feel. The elephant statue is the main focus of the image, drawing attention to its impressive size and unique positioning."
168337,"The image features a red fire hydrant situated on the sidewalk next to a building. There are several people in the scene, with one person standing close to the fire hydrant and others scattered around the area. Some of the people are carrying backpacks, with one backpack located near the center of the scene and another one towards the right side. The overall atmosphere suggests a busy urban setting."
168593,"The image features a room with two white refrigerators placed next to each other. One refrigerator is positioned closer to the left side of the room, while the other is located more towards the center. A chair is situated in the right corner of the room, and a window can be seen in the background. The room appears to be a combination of a kitchen and a living space."
170278,"The image features a large brown dog lying on a bed, comfortably resting on a blue comforter. The dog occupies a significant portion of the bed, with its body stretching from the left side to the right side.

In the room, there is a chair located near the left side of the bed, and a TV can be seen in the background, slightly above the center of the image. Additionally, there are two books placed on the bed,"
170474,"The image features a tennis player in the middle of a game, holding a tennis racket and preparing to hit the ball. The player is focused on the ball, which is in the air, and is about to make contact with the racket.

The scene takes place on a tennis court, with a bench visible in the background. The tennis player is the main subject of the image, showcasing their skill and determination during the match."
172595,"The image features a desk with a laptop, a monitor, and a keyboard placed on it. The laptop is positioned on the left side of the desk, while the monitor is situated in the middle. The keyboard is located towards the right side of the desk.

In addition to the computer equipment, there are several books scattered around the desk. Some books are placed near the laptop, while others are located closer to the monitor. A chair is also"
173091,"The image features a dining table with a variety of food items and beverages. There is a sandwich placed on the table, accompanied by a cup of coffee. Additionally, there are two donuts on the table, one near the center and the other towards the right side. A bottle is also present on the table, possibly containing a beverage. The table setting creates a pleasant atmosphere for enjoying a meal or snack."
173830,"The image captures a person skiing down a snowy slope, wearing a helmet for safety. The skier is focused on the ground, possibly preparing to make a turn. The skier is wearing a black jacket, which provides warmth and protection from the cold weather.

The skier is also equipped with a pair of skis, which are visible beneath them as they glide down the slope. The scene is set against a"
174004,"The image features an old yellow truck parked in a grassy field. The truck is surrounded by tall grass, giving it a rustic appearance. The truck is positioned in the middle of the field, with the front facing the viewer.

There are several people in the scene, with one person standing close to the truck, another person further back, and two more people on the right side of the image. The presence of these individuals suggests"
175251,"The image features a young boy brushing his teeth with a green toothbrush. He is standing in a bathroom, and the scene is captured from the side. The boy is focused on his task, and the toothbrush is visible in his mouth.

In the background, there is a sink, and a cup can be seen placed nearby. Additionally, there are two books in the scene, one located on the left side and the other on the"
178982,"The image features two people riding motorcycles under a bridge. Both motorcycles are positioned close to each other, with one motorcycle slightly ahead of the other. The riders are wearing helmets, ensuring their safety while enjoying the ride.

The scene also includes a traffic light, which is located on the right side of the image. The traffic light is currently displaying a red light, indicating that the riders should stop and wait"
179898,"The image features a young boy holding up two hot dogs, each with a bun. The boy is wearing a blue hat and a blue shirt, and he is surrounded by several other people. Some of the individuals are sitting on chairs, while others are standing.

In the background, there are multiple chairs, a dining table, and a backpack. The scene appears to be a casual gathering or event where the boy is showc"
180878,"The image features a birthday cake with a unique design, resembling a handbag. The cake is placed on a dining table, surrounded by various items. There is a cell phone on the table, as well as a handbag, which is likely the inspiration behind the cake's design. Additionally, there are two books on the table, one located near the cake and the other further away."
185157,"The image features a street sign with a yellow light mounted on top of it. The sign is located on the side of a building, possibly in an Italian city. The sign is pointing to the right, indicating a specific direction.

In the background, there are two bicycles parked on the left side of the scene. One bicycle is positioned closer to the left edge of the image, while the other is slightly further back."
185472,"The image features a man riding a bicycle on a sidewalk next to a train track. The train is visible in the background, traveling down the tracks. The man is wearing a safety vest, which indicates that he might be working in the area.

There are also two handbags in the scene, one located near the man on the bicycle and the other further away. The presence of these handbags suggests that the man might"
186624,"The image features a large green train engine parked on a track. The train is positioned in the middle of the scene, with a woman standing nearby, possibly admiring the train or waiting for it to depart. The train occupies a significant portion of the image, stretching from the left side to the right side.

In addition to the train, there are two other people in the scene, one located on the left side and the other on the right side"
186980,"The image features a cozy kitchen with wooden cabinets and a wooden dining table. The table is set with two blue plates, two forks, two knives, and two spoons, ready for a meal. There are also two wine glasses placed on the table.

In the kitchen, a refrigerator is visible on the left side, while an oven can be seen on the right side. A microwave is located above"
187362,"The image features a man standing on the beach, holding a surfboard. He is wearing swim trunks and appears to be enjoying his time near the ocean. The surfboard is positioned horizontally, with the man standing close to it. The beach setting is further emphasized by the presence of the ocean in the background."
189078,"The image features a white plate with a variety of fruits and vegetables arranged on it. There are several apples, with one placed towards the left side of the plate, another in the middle, and the third one on the right side. Additionally, there are two oranges, one located in the middle of the plate and the other towards the right side.

A banana can be seen on the left side of the plate, while a carrot is placed"
189475,"The image depicts a family gathered around a dining table, enjoying a meal together. There are several people seated at the table, including a young boy and a woman. The table is set with various items, such as cups, bowls, and a knife.

In addition to the people and tableware, there are multiple potted plants placed around the room, adding a touch of greenery to the scene. A bottle can"
189752,"The image features a dining table with a variety of food items on it. There are two pizzas, one placed towards the right side of the table and the other closer to the left side. A person is sitting at the table, enjoying the meal.

In addition to the pizzas, there are two cups on the table, one near the top right corner and the other near the top left corner. A fork is also visible on the"
189820,"The image features a well-equipped office desk with a computer setup. There is a desktop computer with a keyboard and a mouse placed on the desk. A laptop is also present on the desk, along with a cell phone. 

The office space is filled with various items, including a TV mounted on the wall, a cup, a book, and a bottle. There are also two chairs in the room, one near the desk and"
192964,"The image captures a man skillfully performing a trick on a skateboard, flying through the air while riding the skateboard. He is in the middle of the trick, showcasing his talent and control over the skateboard.

The scene takes place in a dark setting, with the skateboarder being the main focus. The skateboard is positioned underneath him, and the man appears to be the only person in the"
193429,"The image features a snowboarder sitting on the snow with their snowboard attached to their feet. The snowboarder is wearing a black jacket and goggles, and they appear to be taking a break from snowboarding. The snowboard is positioned horizontally across the scene, with the snowboarder sitting in the middle. The snowy environment suggests that the photo was taken at a ski resort or a similar location."
195165,"The image depicts a bathroom scene with a sink and a mirror. The sink is located on the right side of the bathroom, while the mirror is positioned above the sink. The bathroom features a toilet situated in the left corner of the room.

There are several bottles placed around the bathroom, with some near the sink and others scattered around the room. Additionally, there are two bowls, one located near the sink and the"
195918,"The image features a white desk with two computer monitors placed on it. One of the monitors is larger, occupying the left side of the desk, while the other is smaller and positioned on the right side. A keyboard is also visible on the desk, placed in front of the larger monitor.

In addition to the computer setup, there are two chairs in the scene. One chair is located on the left side of the desk,"
198489,"The image features a young girl playing with a pink umbrella on a sidewalk. She is standing on the sidewalk, holding the umbrella in her hand. The scene also includes a car parked in the background, as well as a potted plant nearby. The little girl appears to be enjoying her time outdoors, playing with the umbrella."
198805,"The image features a yellow truck parked in a parking lot, surrounded by other vehicles. The truck is positioned in the middle of the scene, with a car parked to the left and another car parked to the right. The parking lot is filled with various vehicles, including a few more cars and a bus.

In addition to the vehicles, there are two people visible in the scene. One person is located near the left side of the"
200252,"The image features a bed with two pairs of green shoes placed on top of the blanket. The shoes are positioned close to each other, with one pair located towards the left side of the bed and the other pair situated more towards the right side. The bed occupies the majority of the scene, with the shoes being the main focus."
201676,"The image features a group of zebras standing together in a grassy field. There are at least nine zebras visible in the scene, with some standing closer to the foreground and others further in the background. The zebras are positioned in various orientations, creating a sense of depth and movement in the scene. The grassy field provides a natural habitat for these animals, allowing them to graze and interact with one another."
202228,"The image features a man standing in front of a mirror, taking a picture of himself. He is wearing a red jacket, which adds a pop of color to the scene. The man is holding a cell phone, capturing the moment. The mirror reflects the man's image, creating a sense of depth in the image."
206135,"The image features a group of cows standing in front of a church. There are five cows in total, with some of them being closer to the church while others are positioned further away. The cows are of different sizes, and they appear to be calmly waiting or resting in the area.

In the background, there is a clock mounted on the side of the church, which adds to the overall atmosphere of the scene."
206994,"The image features a yellow and red train traveling down the tracks. The train is positioned in the middle of the scene, with the front of the train visible. The train is passing by a bus stop, where a bus is waiting for passengers.

There are several people in the scene, with some standing near the bus stop and others scattered around the area. A bench can be seen close to the bus stop, providing a place for people to sit and wait"
207538,"The image features a white microwave mounted on the wall above a counter. The microwave is placed in the middle of the scene, with the counter extending from the left side to the right side of the image.

There are two knives visible in the scene, one located near the left edge of the image and the other closer to the right side. Additionally, there are two bottles, one situated near the left edge and the other near the right edge"
209222,"The image depicts a man sitting on a bench in a park, enjoying a drink from a bottle. The bench is located near the center of the scene. There are several other people in the park, some sitting on benches and others standing or walking around.

In the background, there are a few cars parked, as well as a truck. Additionally, there are two handbags visible in the scene, one near the man"
209613,"The image features a group of sheep standing together in a grassy field. There are at least nine sheep visible in the scene, with some of them standing closer to the foreground and others further back. The sheep are dispersed throughout the field, creating a sense of unity among the animals."
209747,"The image features a small kitten sitting inside a bathroom sink. The kitten appears to be curious and is looking up, possibly observing the surroundings. The sink is located next to a toilet, which is situated on the left side of the image.

In the scene, there is also a sponge placed on the left side of the sink, and a cup can be seen on the right side. The overall atmosphere of the image is"
211674,"The image features a red double-decker bus driving down a street, with a group of people riding on the top deck. There are at least 13 people visible on the bus, enjoying the ride and the view from the elevated seating area.

In addition to the bus, there are several cars and a truck visible in the scene. One car is located on the left side of the bus, while another car is further down the street"
212226,"The image features a woman sitting in the driver's seat of a yellow truck, smiling and enjoying her time. She is wearing a safety vest, which indicates that she is likely a construction worker or involved in some form of heavy machinery operation. The truck is parked, and the woman appears to be the only person in the scene."
213171,"The image features a young baseball player standing on a field, wearing a baseball uniform. He is holding a baseball glove in his hand, ready to catch the ball. The player is positioned in the center of the scene, with the glove visible in the lower part of the image.

In the background, there is a car parked, likely belonging to one of the spectators or team members. The scene also includes a bench located towards the left"
215259,"The image features two women standing in a living room, playing a video game together. Both women are holding Wii controllers, fully engaged in the game.

The living room is furnished with a couch located in the background, and a chair placed nearby. There are several books scattered around the room, with some placed on the floor and others on the couch. The overall atmosphere suggests a fun and relaxed gaming session between the two friends."
217753,"The image displays a variety of fruits arranged in several plastic containers. There are multiple apples, with some placed in the middle of the containers and others towards the edges. The apples are accompanied by oranges, which are also placed in the containers. The oranges can be seen in different sections of the image, with some near the top, others in the middle, and a few towards the bottom. The containers are filled with a diverse assortment of f"
217948,"The image features three brown bears standing on a metal fence, looking over the top. They are positioned close to each other, with one bear on the left side, another in the middle, and the third on the right side of the fence. The bears appear to be curious about their surroundings, possibly observing something below them."
218091,"The image features a hotel room with a large bed situated in the middle of the room. The bed is adorned with a white comforter and a few pillows. A chair is placed near the bed, and a couch is located on the left side of the room.

In addition to the furniture, there are two lamps in the room, one on the left side and the other on the right side. A remote control can be seen on"
220584,"The image features a man wearing a wetsuit, skillfully riding a surfboard on a wave in the ocean. He is lying on his stomach, maintaining balance as he glides through the water. The surfer is the main focus of the scene, with the surfboard clearly visible beneath him. The ocean waves surrounding the surfer create an exciting and dynamic atmosphere."
222118,"The image features a woman standing outside, talking on her cell phone. She is wearing a black shirt and holding a handbag. The scene is set against a brick wall, which adds a unique backdrop to the photo. The woman appears to be engaged in a conversation, possibly discussing her day or sharing some news with the person on the other end of the line."
224664,"The image depicts a lively beach scene with several people enjoying the day. Some of the people are flying kites, with a total of five kites visible in the sky. The kites come in various shapes and sizes, adding a vibrant touch to the beach atmosphere.

In addition to the kite flyers, there are numerous people scattered across the beach, either participating in the kite-flying activities or simply enjoying the"
224724,"The image features a woman standing outside a building, possibly a restaurant, with a sign in front of it. She is holding a cell phone, possibly checking messages or browsing the internet. The scene also includes a few other people in the background, as well as a motorcycle parked nearby.

In the vicinity, there are several cars parked along the street, with one car closer to the left side of the image and two more cars on the right side"
225757,"The image features a wooden desk with a computer setup. On the desk, there is a white keyboard, a mouse, and a cell phone. A laptop is also present on the desk, along with a monitor. The desk is cluttered with various items, including a book, a cup, and a cell phone.

In the background, there are two TVs, one on the left side and the other on the right side of the image"
226408,"The image features a young girl lying on a bed, surrounded by stuffed animals. She is holding a stuffed animal in her arms, and there are several other stuffed animals scattered around her. The girl appears to be enjoying her time with the stuffed animals, creating a cozy and playful atmosphere."
227686,"The image features a brown horse with a green bridle, standing in a forest. The horse is wearing a harness, and it appears to be walking through the woods. The scene is set in a forest with trees surrounding the horse, creating a serene and natural atmosphere."
231580,"The image features a man standing in front of a cow, possibly giving a presentation or demonstration. The cow is located in the background, and the man is positioned towards the left side of the scene.

There are several people in the scene, with some standing close to the man and others further away. A dining table can be seen in the middle of the scene, and a chair is placed nearby. Additionally, there are two bottles in the scene,"
231879,"The image features a group of people gathered around a dining table, celebrating a birthday. A woman is holding a small cake with a lit candle, and the guests are eagerly waiting for the cake to be served.

There are several people in the scene, with some standing closer to the table and others further away. A chair is visible near the right side of the table, and a handbag can be seen placed on the floor. The"
232244,"The image features an elephant with a red blanket on its back, standing in a forest. The elephant is the main focus of the scene, occupying a significant portion of the image. The blanket on the elephant's back adds a unique touch to the scene."
232348,"The image features a kitchen counter with a toaster oven sitting on top of it. The toaster oven is silver in color and is placed on the counter, ready for use. The counter is also equipped with an electrical outlet, which is located near the toaster oven.

In the background, there is a sink visible, and a bowl can be seen placed on the counter. Additionally, there is a cup placed on the counter,"
