image_id,caption
776,"The image features a group of teddy bears sitting together on a bed. There are five teddy bears in total, with some of them being brown and others being orange. They are arranged in a way that they are all facing the same direction, creating a cozy and inviting atmosphere. The teddy bears are positioned close to each other, forming a small circle on the bed."
785,"The image features a woman wearing a red jacket, skiing down a snowy slope. She is holding ski poles in her hands, maintaining balance and control as she glides through the snow. The woman appears to be enjoying her time on the slopes.

In the background, there are several other people scattered across the scene, possibly skiing or snowboarding as well. The overall atmosphere of the image is lively and full of"
872,"The image captures a baseball game in progress, with two men actively participating. One man is in the middle of throwing a baseball, while the other player is running towards the ball, attempting to catch it. The scene takes place on a baseball field, with the players positioned in the middle of the field.

In addition to the two main players, there are two more people in the background, possibly teammates or spectators. A baseball glove"
1353,"The image features a group of children sitting in a small, colorful train. There are at least nine children visible in the scene, with some sitting closer to the front of the train and others further back. The train appears to be a popular attraction for the children, as they are all enjoying their time together."
1532,"The image depicts a busy highway with several cars and trucks driving under a bridge. There are at least nine cars and two trucks visible in the scene. The vehicles are scattered throughout the highway, with some closer to the foreground and others further back.

In addition to the vehicles, there are two traffic lights present in the scene, one near the center and the other towards the right side. A person can also be seen in the background,"
1675,"The image features a black cat comfortably laying on top of a laptop computer. The laptop is placed on a desk, and the cat appears to be enjoying the warmth of the device. The scene is cozy and inviting, as the cat seems to be relaxing in the laptop's space."
1993,"The image features a cozy bedroom with a large bed situated in the middle of the room. The bed is adorned with a colorful, multi-colored comforter, adding a vibrant touch to the space. A chair is placed near the bed, providing a comfortable seating area.

In addition to the bedroom furniture, there is a dining table located towards the left side of the room. A couple of chairs can"
5992,"The image features a group of sheep standing together in a grassy area. There are three sheep in total, with one on the left side, another in the middle, and the third on the right side. The sheep are standing close to each other, possibly enjoying each other's company. The scene is set in a yard with a brick wall visible in the background."
7784,"The image features a large, colorful kite flying high in the blue sky. The kite is positioned towards the left side of the frame, with its tail extending towards the right side. The kite's vibrant colors and design make it stand out against the backdrop of the clear sky."
8021,"The image features a man wearing a suit and tie, standing in front of a large screen. He appears to be giving a presentation or speech, possibly at a conference. The man is the main focus of the scene, with the screen behind him displaying the content of his speech.

In the background, there are two chairs, one located on the left side of the image and the other on the right side. Additionally, there is a bottle placed on the"
10092,"The image features a bedroom with a large bed, which is covered by a mosquito net. The bed is positioned in the center of the room, and the mosquito net is draped over it, providing a comfortable and secure sleeping environment.

In addition to the bed, there are two chairs in the room, one located near the left side and the other near the right side. A potted plant is placed in the room,"
11051,"The image features a young man wearing a suit and tie, with a woman fixing his tie. The man is smiling, and the woman is laughing, creating a joyful atmosphere. The scene takes place in a room with a couch in the background.

There are two other people in the room, one standing near the left side of the image and the other person located on the right side. Additionally, there is a vase placed on a surface in"
11149,"The image features a street scene with several bicycles parked along the sidewalk. There are three bicycles in the foreground, with one being a yellow bicycle, and the other two being black bicycles. In the background, there is another bicycle parked further away.

A person can be seen in the scene, possibly walking by or preparing to ride one of the bicycles. Additionally, there is a motorcycle"
11615,"The image features a street sign with various directions and signs pointing towards different locations. The sign is located in a forest, surrounded by trees. There are several signs on the pole, including one pointing towards a parking area. The signs are placed at different angles, providing clear guidance for those navigating the area."
13291,"The image features a group of four young men posing together in a grassy field at night. They are all holding frisbees, with three frisbees visible in the scene. The men are standing close to each other, with one man on the left side, another in the middle, and the remaining two on the right side. The scene appears to be a fun and casual gathering of friends."
15335,"The image features a family gathered around a dining table, enjoying a meal together. There are three people in the scene, with one person on the left side, another in the middle, and the third person on the right side.

The table is set with various items, including a cup, a fork, a knife, and a spoon. The family appears to be sharing a meal, possibly eating pizza, as there are two p"
16439,"The image features a desk with a laptop computer placed on top of it. The laptop is turned on, and there is a glass of wine nearby. A cell phone is also present on the desk, along with a remote control. The desk is situated in a room with a couch in the background."
17436,"The image features a man sitting on a bench in front of a large church with a tall tower. The man is reading a book while enjoying the peaceful surroundings. The church has a prominent presence in the scene, with its tower visible above the man.

There are several potted plants placed around the area, adding a touch of greenery to the scene. Some of the plants are located close to the bench, while others are scattered throughout the"
17959,"The image features a lively scene at a park, where a large group of people is gathered to fly kites. There are several kites in the air, with some of them being shaped like fish. The kites are scattered throughout the scene, with some flying higher and others closer to the ground.

In addition to the kites, there are numerous people of various ages and sizes, all enjoying the outdoor activity. Some of them are standing close"
18150,"The image features a man and a young boy sitting on a bed, sharing a pizza. The man is holding a slice of pizza, and the boy is eagerly waiting for his share. The scene is cozy and intimate, with the man and the boy enjoying each other's company.

In the room, there is a couch located in the background, and a bottle can be seen placed nearby. The overall atmosphere is warm and inv"
19432,"The image features two men playing tennis on a court. One of the men is holding a tennis racket, preparing to hit the ball. The tennis ball is in the air, close to the player with the racket.

There are several chairs placed around the court, likely for spectators or players to rest during breaks. The chairs are arranged in various positions, with some closer to the players and others further away."
19924,"The image features a woman wearing a hat and a tie, smiling while holding a cigarette. She is also brushing her teeth, which adds a unique element to the scene. The woman is the main focus of the image, and her smile and actions create a lively atmosphere."
20553,"The image features a stuffed teddy bear sitting on a chair in the middle of a dirt field. The teddy bear is surrounded by various items, including a bottle, a cup, a vase, and a wine glass. The teddy bear is also holding a baseball bat, adding a playful element to the scene. The arrangement of these items creates a unique and interesting display in the middle of the field."
20992,"The image features a woman with short hair, wearing a black shirt, and holding a hot dog in her mouth. She is eating the hot dog while looking at the camera. The woman is the main focus of the scene, and the hot dog is placed in the lower part of the image."
22479,"The image captures a young man skillfully performing a trick on his skateboard at a skate park. He is in the air, showcasing his talent and balance. The skateboard is positioned underneath him, with the wheels visible.

The skate park is surrounded by a few benches, one located near the left side of the image, another in the middle, and the third one on the right side. There is also"
22969,"The image features two giraffes standing next to each other in a grassy area. One giraffe is positioned closer to the left side of the image, while the other is located more towards the right side. They appear to be enjoying their time in the grassy field."
23272,"The image features a cat sitting on the hood of a black car. The car is parked on the street, and the cat appears to be enjoying the warmth of the hood. The scene also includes a truck parked nearby, and a potted plant located close to the car."
24144,"The image features a large, round pizza with a golden crust, topped with cheese and tomato sauce. The pizza is placed in a box, which is open, revealing the delicious meal inside. The pizza is cut into several pieces, making it easy to serve and enjoy. The cheese is spread evenly across the pizza, adding to its appetizing appearance."
24610,"The image features a cozy living room with a comfortable couch situated in the background. A dining table is located in the foreground, accompanied by a chair. The room is decorated with various books, some of which are placed on the dining table, while others are scattered around the room.

In addition to the books, there are two handbags in the room, one near the couch and the other closer to the dining table. A"
27982,"The image features a white toilet situated in a bathroom. The toilet is placed next to a sink, which is located on the right side of the bathroom. Above the sink, there is a mirror, providing a functional and aesthetically pleasing space.

In addition to the toilet and sink, there are two bottles placed on the left side of the bathroom, possibly containing toiletries or cleaning supplies"
28285,"The image features a large white church with a blue roof, standing tall in the background. The church has a clock tower, which is visible in the middle of the scene. The clock is positioned on the side of the tower, making it easy to see the time.

In the foreground, there is a small white building with a balcony. The balcony is adorned with several lights, creating a warm and inviting atmosphere. The combination"
30675,"The image features a large orange and black train traveling down the tracks. The train is positioned in the middle of the scene, with the front of the train on the left side and the back of the train on the right side. The train appears to be moving swiftly, possibly through a rural area."
31322,"The image features a large body of water with a group of white swans swimming and floating on the surface. There are at least 14 swans visible in the scene, scattered throughout the water. Some swans are closer to the foreground, while others are further away, creating a sense of depth in the scene. The swans appear to be enjoying their time in the water, creating a serene and picturesque atmosphere."
33707,"The image features two giraffes standing close to each other in a grassy area. They are positioned near a building, possibly a zoo or a wildlife sanctuary. The giraffes are facing each other, creating a sense of connection between them. The scene is set in a lush green environment, with trees in the background."
35770,"The image features a bathroom with a white toilet and a white sink. The sink is placed on a glass table, which is situated next to the toilet. The bathroom also has a black and white checkered floor, adding a unique touch to the space.

In addition to the main fixtures, there are a few other items in the bathroom. A cup can be seen on the left side of the sink, while a bowl"
37777,"The image showcases a large, well-equipped kitchen with wooden cabinets and a tile floor. The kitchen features a white stove, a sink, and a dining table with chairs. There are several oranges placed on the table, as well as a banana.

In addition to the main appliances, the kitchen also contains a microwave, an oven, a toaster, and a refrigerator. A potted"
38210,"The image features a snowy landscape with a man wearing a red and white ski suit standing on skis. He is holding ski poles in his hands, ready to ski down the slope. Another person can be seen in the background, possibly skiing or preparing to ski.

The scene is set in a snowy forest, with trees surrounding the area. The man in the red and white ski suit is the main focus of the image, as he stands"
39484,"The image depicts a busy city street filled with traffic. There are several cars, including a truck, driving down the street. A few people can be seen walking along the sidewalk, with some of them carrying handbags.

The street is lined with various businesses, including a movie theater, a bookstore, and a restaurant. A large billboard is also visible on the side of the street, adding to the bustling atmosphere"
41488,"The image features a green street sign with white text, indicating the location of Queens, New York. The sign is placed on a pole, and it is situated near a highway. The sign is positioned in the middle of the scene, with the highway stretching out in the background."
41990,"The image features three women standing on a snowy hill, each wearing skis. They are posing for a picture, with one woman on the left, another in the middle, and the third on the right. The women are all smiling, enjoying their time on the snowy slope.

In addition to the skis, there are two backpacks visible in the scene. One is located near the leftmost woman, while the other is placed"
43314,"The image captures a thrilling moment of a skier in action, as they are captured in mid-air while skiing down a snowy slope. The skier is wearing an orange and white outfit, and their skis are visible in the air.

In the background, there are two more people, possibly watching the skier or waiting for their turn to ski. The scene is set against a beautiful snowy mountain backdrop, making it an"
45550,"The image features a man sitting at a dining table, holding up a plate with a sandwich on it. He is smiling and appears to be enjoying his meal. The table is surrounded by chairs, with one chair visible on the left side of the table and another on the right side.

In the background, there are several other people present, some of whom are seated at the table, while others are standing or sitting in the area."
46378,"The image features a cat lying on the ground, with a dead bird in its mouth. The cat is positioned towards the left side of the scene, while the bird is located towards the right side. The cat appears to be enjoying its meal, as it is eating the bird."
46804,"The image features a large, fluffy white sheep standing in a grassy field. The sheep is positioned in the middle of the scene, occupying a significant portion of the image. The grassy field extends from the foreground to the background, providing a natural setting for the sheep."
46872,"The image features a flatbed truck parked on the street, with a large pipe or tube placed on the back of the truck. The truck is parked in front of a building, and there are two men standing nearby, possibly discussing the pipe or tube.

In addition to the truck, there are two suitcases visible in the scene, one located near the left side of the truck and the other closer to the right side"
47585,"The image features a bride and groom standing together under an umbrella. The bride is wearing a white dress, while the groom is dressed in a suit. They are both smiling, enjoying their special day.

In the background, there are several other people, some of whom are also holding umbrellas. The scene appears to be a lively outdoor gathering, with the couple at the center of attention."
48396,"The image features a woman and a young boy standing in a kitchen, both holding knives. The woman is on the left side of the image, while the boy is on the right side. They appear to be preparing a meal together.

The kitchen is equipped with a dining table in the background, and a chair is placed nearby. There are two bowls on the table, one closer to the woman and the other near the boy. Additionally,"
49091,"The image depicts a narrow alleyway in an Asian city, filled with numerous signs written in an Asian language. The signs are hanging from the sides of buildings, creating a unique atmosphere.

In addition to the signs, there are several people walking along the alleyway, possibly exploring the area or going about their daily activities. The scene is bustling with activity, showcasing the vibrant and lively nature of the city."
49761,"The image features a large herd of zebras and wildebeests gathered in a grassy field. There are at least 14 zebras and 11 wildebeests visible in the scene. The zebras are spread out across the field, with some closer to the foreground and others further in the background. The wildebeests are also dispersed throughout the field, with some near the zebras and others in the middle"
51309,"The image features a group of horses standing together in a grassy field. There are five horses in total, with some of them being brown and black. The horses are positioned in various directions, creating a sense of depth in the scene.

In addition to the horses, there is a small horse, likely a foal, standing close to the adult horses. The foal is located on the left side of the image, near the center. The horses are all"
52007,"The image features a yellow double-decker bus parked on the side of the road. There are several people around the bus, with some standing close to it and others further away. One person is standing near the bus, while another is standing further back.

In addition to the bus, there are two bicycles in the scene. One bicycle is located near the left side of the image, while the other is positioned more towards the center."
53624,"The image features an elephant standing in a watering hole, drinking water from the pond. The elephant is the main focus of the scene, with its trunk submerged in the water.

In the background, there are several people observing the elephant from a safe distance. Some of them are standing close to each other, while others are scattered around the area. The scene appears to be a mix of a zoo or a"
59635,"The image captures a lively scene at a beach, where a group of people is gathered around a surfboard. A woman is holding the surfboard, while another person is standing nearby. There are several other people in the scene, some of whom are closer to the water, while others are further back.

In the background, there are two bicycles parked, possibly belonging to some of the beachgoers. The overall atmosphere suggests a fun"
60102,"The image features two young men playing soccer on a field. One of the men is wearing a blue shirt, while the other is wearing a black and red shirt. They are both focused on the soccer ball, which is located in the middle of the field.

The players are positioned close to each other, with one player on the left side of the field and the other on the right side. The soccer ball is in the air"
60770,"The image features two zebras standing in a grassy field. One zebra is positioned closer to the left side of the image, while the other is located more towards the right side. They appear to be grazing on the grass in the field.

In the background, there are a few trees, with one tree located near the left side of the image and two more trees on the right side. The scene is set in a lush green field"
61471,"The image features a small brown dog standing on a bathroom rug, sniffing the floor. The dog is positioned close to a white toilet, which is located on the left side of the room. The bathroom also contains a sink, which is situated on the right side of the room.

In addition to the toiletries, there are several bottles scattered around the bathroom. Some are placed on the floor, while others are located"
63047,"The image features a man wearing a Hawaiian shirt, holding a bag of food in his hand. He is standing in front of a building, possibly a restaurant or a food stand. There are several other people in the scene, some of them standing close to the man, while others are further away.

In the background, there is a cup placed on a surface, possibly a table or counter. The scene appears to be a lively gathering or a"
63965,"The image features a woman holding a plate with a slice of cake on it. The cake is decorated with a heart-shaped red flower, adding a touch of elegance to the dessert. The woman is positioned in the center of the scene, with the cake occupying the majority of the plate. The plate is placed on a dining table, which is visible in the background."
64462,"The image features a woman wearing a blue jacket and goggles, standing on a snowy hill with her skis on. She is smiling and appears to be enjoying her time on the snowy slope. The woman is the main focus of the scene, with her skis prominently visible."
64499,"The image features two zebras standing next to each other in a brick-paved area. One zebra is positioned closer to the left side of the image, while the other is located more towards the right side. They appear to be standing near a wall, possibly in a courtyard or a similar outdoor setting."
65736,"The image features a woman playing tennis on a court. She is holding a tennis racket and is in the process of hitting a tennis ball with it. The woman is wearing a black shirt and shorts, and she is focused on her game.

The tennis ball is in the air, close to the woman, while the tennis racket is positioned in her hand, ready for the next swing. The scene captures the intensity and skill of the woman"
67180,"The image features a woman sitting on a wooden bench, wearing a hat and a green jacket. She is positioned in the middle of the bench, with her legs crossed. The bench is located near a stone wall, which adds to the overall atmosphere of the scene."
69213,"The image features two men wearing hats, standing close to each other on a street. They are both dressed in suits, with one man wearing a blue suit and the other wearing a brown suit. The men appear to be engaged in conversation or simply enjoying each other's company.

In the background, there are several other people visible, some of whom are also wearing hats. Additionally, there are two motorcycles parked nearby"
71451,"The image features a neatly made bed in a hotel room. The bed is covered with white sheets and has two white pillows on it. A towel is placed on the bed, with one end of the towel hanging off the side. The room appears to be well-maintained, and the bed is the main focus of the scene."
75456,"The image features a delicious pizza with a variety of toppings, including ham, pineapple, and peppers. The pizza is placed in a metal pan, which is filled with the pizza slices. The pizza is cut into several pieces, making it easy to serve and enjoy. The pizza is placed on a dining table, ready to be shared among friends or family."
76468,"The image features two female tennis players on a court, shaking hands and exchanging a friendly gesture. They are both holding tennis rackets, with one racket closer to the left side of the court and the other racket closer to the right side.

There are several other people in the scene, some of them possibly being the audience or other players. A chair is also visible in the background, likely placed for the players to rest during breaks. The overall"
77396,"The image features a living room with a television on the left side of the room. A cat is lying on the floor, stretching out and enjoying the relaxing atmosphere. Another cat is standing nearby, possibly observing the first cat.

In the room, there is a chair positioned towards the right side of the scene. A laptop is placed on a surface close to the television, and a remote control can be seen on the right side of the room."
81766,"The image features a large black dog sitting on a set of wooden steps. The dog is positioned in the middle of the scene, occupying the majority of the image.

In the background, there are two other dogs, one located on the left side of the image and the other on the right side. The scene also includes a person standing near the left side of the image, possibly observing the dogs or interacting with them."
82807,"The image features a small brown and white dog sitting on a chair, seemingly enjoying a dessert. The dog is positioned close to a dining table, where a cupcake is placed on the table. The chair is located near the edge of the table.

In the background, there are two people, one on the left side and the other on the right side of the image. Additionally, there are two cups placed on the table, one"
