image_id,caption
393014,"The image features a display case in a restaurant, showcasing a variety of sandwiches. There are three sandwiches in the display case, each with different fillings. One sandwich is placed towards the left side, another in the middle, and the third one is on the right side.

In addition to the sandwiches, there are two strawberries visible in the display case. One strawberry is located near the left side of"
393226,"The image features a man walking across a street in front of a large, colorful ice cream truck. The truck is parked on the side of the road, and the man is walking towards it, likely to purchase some ice cream.

There are several cars parked or driving along the street, with one car located near the ice cream truck and others scattered throughout the scene. Additionally, there are two traffic lights visible in the background,"
394328,"The image features a white toilet situated in a red room. Above the toilet, there is a sign that reads ""Nike 20 December."" The room also has a red brick wall, which adds to the overall ambiance."
394940,"The image features a young boy sitting at a dining table, holding a plate with a piece of cake on it. He appears to be deep in thought or possibly contemplating the dessert. The table is surrounded by chairs, with one chair located on the left side of the table and another on the right side. The boy is the main focus of the scene, with the cake and the table occupying the majority of the image."
396274,"The image features a garden with a variety of green plants, including broccoli, growing in the dirt. There are several broccoli plants scattered throughout the garden, with some closer to the foreground and others further back. The plants are situated near a wooden fence, which adds a natural and rustic touch to the garden. The scene is a beautiful representation of a healthy and thriving garden."
398377,"The image features three women sitting on a bench, each with their own handbag. One woman is on the left side of the bench, another is in the middle, and the third is on the right side. They appear to be waiting for something, possibly a train, as they sit close together.

There are two handbags visible in the scene. One handbag is placed near the left woman, while the other handbag is located near the right"
399764,"The image features a man standing next to a brown cow, possibly a steer, with a red ribbon around its neck. The man is holding a camera, possibly taking a picture of the cow. There are several other people in the scene, some of them standing close to the man and the cow, while others are further away.

In the background, there is a horse, which adds to the rural atmosphere of the scene. The presence of multiple people and the"
400044,"The image captures a thrilling moment of a snowboarder performing a trick in mid-air. The snowboarder is in the middle of the jump, with their snowboard clearly visible. The scene is set against a backdrop of a tall building, adding to the excitement of the action. The snowboarder's skill and daring are evident as they soar through the air."
400367,"The image depicts a busy city street at night, with numerous cars driving down the road. The street is illuminated by streetlights, creating a lively atmosphere. The cars are scattered throughout the scene, with some closer to the foreground and others further back.

In addition to the cars, there are two traffic lights visible in the image, one near the center and the other towards the right side. The streetlights and traffic lights contribute to"
401446,"The image features a woman standing under an umbrella, possibly during a rainy day. She is wearing a pink dress and holding a white purse. The woman is also wearing a headband. The scene takes place in a park, with a bench visible in the background. The woman appears to be enjoying her time outdoors despite the weather conditions."
402720,"The image features three men sitting together at a dining table, enjoying a meal and drinking wine. They are all smiling and posing for the camera. The table is set with various wine glasses, some of which are placed closer to the men, while others are further away.

In addition to the wine glasses, there are a couple of bottles on the table, one near the center and the other towards the right side. A fork"
402992,"The image features a large group of brown cows lying down in a grassy field. There are at least 13 cows visible in the scene, with some cows lying closer together and others spread out across the field. The cows are resting comfortably in the grass, enjoying the peaceful environment."
404191,"The image features a white refrigerator with a large number of magnets covering its surface. The magnets are arranged in various patterns, creating a visually interesting scene. The refrigerator is placed in a kitchen setting, and the magnets are scattered all over the fridge, making it a unique and personalized space."
411938,"The image features a group of people riding bicycles down a street. Among the riders, there is a man holding a teddy bear, which adds a playful element to the scene. The group is diverse, with some people riding bicycles and others standing or sitting nearby.

There are multiple bicycles in the scene, with one prominently visible in the foreground and another in the background. A few people are also holding cu"
413395,"The image features a man sitting on a couch, holding a wine glass in his hand. He is accompanied by two cats, one on his left side and the other on his right side. The man appears to be enjoying his time with the cats, creating a cozy and relaxed atmosphere."
414133,"The image features a street sign with the word ""WHOA"" written on it. The sign is located near the center of the scene, with a street corner nearby. The street is lined with several cars parked on the side, including a truck parked further back.

There are also a few benches placed along the street, providing seating options for pedestrians. One bench is located near the left side of the scene, while"
414340,"The image features a clock tower with a clock on the top, located in the middle of a town. The clock tower is situated between two buildings, one of which is a church. The scene is set against a backdrop of a mountain, adding to the picturesque atmosphere.

There are several people in the scene, with some standing near the clock tower and others scattered throughout the town. A bench can be seen in the foreground, providing a place for people"
415536,"The image features a city bus driving down a street, surrounded by trees. The bus is positioned in the middle of the scene, with the trees on both sides of the road. The street appears to be wet, possibly due to rain or recent rainfall. The bus is the main focus of the scene, with the surrounding trees and the wet street creating a sense of urban life."
415727,"The image features two young boys sitting on a bench, each holding a baseball bat. They are likely waiting for their turn to play or practice their baseball skills. The bench is located near a fence, which is holding multiple baseball bats. The boys are focused on their bats, possibly preparing for their next move or discussing their game strategy."
415741,"The image depicts a small bedroom with a bed and a couch. The bed is located in the middle of the room, while the couch is situated towards the right side. There are two chairs in the room, one near the left side and the other near the right side.

A few personal items can be seen in the room, including a handbag placed on the right side of the room, a backpack on the left side, and"
415882,"The image is a black and white photograph of a woman lying in bed. She is wearing a long, flowing dress, and her eyes are closed. The bed is covered with a blanket, and there is a clock on the wall above her. The scene appears to be from the 1920s, as suggested by the black and white nature of the photo."
416256,"The image features a cat lying on the floor, comfortably resting on a computer keyboard. The cat is positioned in the middle of the scene, occupying a significant portion of the image. The keyboard is placed on the floor, with the cat lying directly on top of it. The scene appears to be a cozy and relaxed environment for the cat."
417285,"The image is a collage of four pictures, each showcasing a different food item. The first picture features a delicious-looking cake, while the second picture displays a cup of coffee. The third picture showcases a plate of pastries, and the fourth picture features a slice of pizza.

In addition to the food items, there are two cups visible in the collage. One cup is placed in the middle of the collage, while"
419098,"The image features a pink pair of scissors with a chain attached to the handle. The scissors are placed on a table, and there are several other pairs of scissors in the background. The scissors are arranged in a row, with some of them being pink as well. The scene gives the impression of a workspace or a place where scissors are commonly used."
419379,"The image features a display of various donuts on a tray. There are at least nine donuts visible, each with different flavors and toppings. Some of the donuts are placed on a metal rack, while others are arranged on a table. The donuts are spread out across the scene, with some closer to the front and others further back. The assortment of donuts creates an inviting and delicious presentation for customers to enjoy."
420230,"The image features a large brown elephant standing on a dirt ground near a body of water. The elephant is facing the camera, with its trunk raised, possibly in a playful or curious manner. The scene is set in a natural environment, with the elephant being the main focus of the image."
421060,"The image captures a thrilling moment of a snowboarder performing a trick in the air. The snowboarder is in the middle of the jump, with their snowboard clearly visible. The scene is set on a snowy slope, where several other people can be seen scattered around the area, possibly watching the snowboarder's performance."
422706,"The image features a boat floating on the water, with a woman standing on the deck of the boat, looking down at the boat. The boat is positioned in the middle of the scene, and the woman appears to be observing the boat from a higher vantage point. The boat is quite large, occupying a significant portion of the image."
423798,"The image captures a nighttime city street scene with a bright light illuminating the area. The light is coming from a street light, which is located near the center of the scene. The street is busy with traffic, including cars and a truck, moving in various directions.

There are multiple traffic lights visible in the scene, with one near the left edge, another in the middle, and the third on the right side. The streetlights and traffic"
426329,"The image features a display case filled with a variety of delicious desserts. There are numerous cakes, each with different flavors and toppings. Some of the cakes are placed in the middle of the display, while others are positioned towards the edges.

In addition to the cakes, there are a few donuts scattered throughout the display, adding to the assortment of sweet treats. The display case is located in a store, likely"
427160,"The image captures a group of young boys playing baseball on a field. There are at least five boys actively participating in the game, with some of them running and others standing in various positions.

One boy is holding a baseball glove, likely preparing to catch the ball. The boys are spread out across the field, with some closer to the foreground and others further in the background. The scene is lively, showcasing the excitement and energy"
427649,"The image features a small sailboat floating on a large body of water, possibly a lake. The boat is situated in the middle of the scene, with the water surrounding it. The boat is the main focus of the image, and it appears to be the only boat in the water. The serene atmosphere suggests a peaceful day on the water."
427997,"The image features a woman standing on a tennis court, holding a tennis racket and preparing to play. She is wearing a white dress, which is typical attire for female tennis players. The tennis court is surrounded by a crowd of people, who are likely spectators or fellow players.

There are several chairs placed around the court, possibly for the audience or for players to rest during breaks. The scene captures the excitement and anticipation of a tennis"
429690,"The image captures a baseball game in progress, with a man in the center of the scene swinging a baseball bat at a ball. The ball is in the air, close to the batter. 

There are several other people in the scene, including teammates and opponents, as well as some spectators. Some of the people are standing near the batter, while others are scattered around the field. A bench can be seen in the background, likely"
429718,"The image features a green steam train traveling down the tracks, with smoke billowing from the top of the train. The train is moving along the tracks, which are surrounded by trees.

There are two traffic lights in the scene, one located near the top right corner and the other in the middle right area. The traffic lights are positioned above the train tracks, ensuring the safe passage of the train."
431568,"The image features a delicious pizza with a variety of toppings, including meat, cheese, and vegetables. The pizza is placed on a dining table, which is covered with a red and white checkered tablecloth. The pizza is cut into slices, making it easy to serve and enjoy. The table is surrounded by chairs, with one chair located on the left side and another on the right side."
433243,"The image features a giraffe and a zebra standing close to each other in a zoo setting. The giraffe is on the left side of the zebra, with the zebra positioned in the middle of the scene. Both animals are eating from a shared feeding area.

In the background, there are a few more zebras, one on the right side of the image and another further back. The scene also includes a"
434230,"The image features a woman standing in a room filled with various blue and white plates. She is surrounded by a large collection of plates, which are displayed on the walls and on the floor. The room appears to be a shop or a display area, showcasing the plates for sale or exhibition.

There are several people in the room, including the woman in the center, and others scattered around the area. Some of the people are closer to the pl"
437351,"The image features a woman sitting on a chair next to a pile of luggage. She is wearing a hat and appears to be posing for the picture. The luggage consists of two suitcases, one on the left side and the other on the right side of the woman. The scene is set in a room with a couch in the background."
438774,"The image depicts a group of people gathered in a kitchen, enjoying each other's company. There are at least five people in the scene, with some standing and others sitting around a dining table. The table is set with wine glasses, cups, and a cake, indicating a celebration or a social gathering.

The kitchen is well-equipped with various appliances, including a refrigerator, an oven"
439290,"The image features a bunch of green bananas hanging from a tree. The bananas are arranged in a row, with some of them appearing to be overripe. The tree is surrounded by a lush green environment, providing a natural setting for the bananas."
439426,"The image features a person holding a delicious-looking doughnut in their hand. The doughnut is placed in the center of the scene, with the person's hand positioned on the left side.

In the background, there are two other people, one standing closer to the left side of the image and the other person further to the right. Additionally, there is a bench visible in the background, extending from the left side to the right side"
439525,"The image features a man and a woman standing together, cutting a white cake placed on a dining table. The couple is sharing the moment, with the man on the left and the woman on the right.

There are several wine bottles scattered around the table, adding to the celebratory atmosphere. In addition, there are two wine glasses, one near the center of the table and the other closer to the right side. The scene appears to be a joy"
442161,"The image features three people standing together, each holding a wine glass. They are all smiling and enjoying their time together. The wine glasses are placed in various positions, with one glass closer to the left side, another in the middle, and the third glass on the right side. The people are positioned in a way that they are all visible, with one person on the left, another in the middle, and the third person on the right."
444275,"The image features a small white microwave sitting on the ground next to a white toaster oven. Both appliances are placed on a concrete surface. The microwave is positioned closer to the left side of the scene, while the toaster oven is located more towards the center. The scene appears to be set outdoors, possibly in a yard or a similar location."
445658,"The image features a large, well-equipped kitchen with wooden cabinets and black appliances. The kitchen is filled with various items, including a refrigerator, oven, microwave, and sink. There are also several bottles placed around the kitchen, as well as a bowl and a cup.

In addition to the appliances, the kitchen is decorated with a few items such as a teddy bear, a vase"
445999,"The image features a woman brushing her teeth with a toothbrush in her mouth. She is looking at the camera while performing this activity. The woman is wearing a ring on her finger, which is visible in the foreground. The scene is set in a room with a window in the background."
446574,"The image features a small bathroom with a white toilet positioned on the left side of the room. A white bathtub is located on the right side of the bathroom, and a shower curtain is hanging over the tub. The bathroom also has a sink, which is situated close to the toilet.

In addition to the main fixtures, there are a few other items in the bathroom. A toothbr"
447088,"The image features three baseball players walking together on a field. They are wearing baseball uniforms and are carrying baseball bats. The players are positioned in a line, with one player on the left, another in the middle, and the third on the right. The players are likely preparing for a game or practice session."
447314,"The image features a woman and a child flying a kite on a grassy hill. The woman is holding the kite string, while the child is standing nearby. There are several other people in the background, possibly enjoying the outdoor activity as well. The scene is set against a backdrop of a large stone tower, which adds to the picturesque atmosphere."
447611,"The image features a person skillfully using a pair of scissors to remove the back cover of a laptop computer. The person is focused on their task, with the scissors in their hands. The laptop is placed on a wooden table, which occupies the majority of the scene. The person's hands are visible, holding the scissors and guiding the cutting process."
450439,"The image features a kite flying high in the blue sky. The kite is shaped like the American flag, with red, white, and blue colors. The kite is soaring in the air, with the blue sky serving as the perfect backdrop. The scene is a beautiful representation of the national flag, showcasing the kite's design and the clear day."
451435,"The image features a tennis court with a tennis ball placed on the court. The court is surrounded by a green wall, giving it a unique appearance. The tennis ball is located near the center of the court, and the court appears to be empty, with no players or spectators visible. The scene is captured in a black and white photo, which adds a timeless and classic feel to the image."
452321,"The image features a red and white bus parked at a bus stop, likely waiting for passengers. The bus is positioned in the middle of the scene, with a few people scattered around the area. Some of these individuals are standing close to the bus, while others are further away.

In addition to the bus, there are two benches visible in the scene. One bench is located near the left side of the image, while the other is situated closer to"
453001,"The image features two women standing on a patio, each holding a suitcase. They appear to be preparing for a trip or returning from one. The women are positioned close to each other, with one woman standing slightly behind the other.

The patio is surrounded by various potted plants, with one plant located near the left side of the image, another in the middle, and the third plant on the right side. The scene also includes a bench"
458054,"The image features a row of white toilets placed on the ground in a wooded area. There are a total of nine toilets in the scene, with some of them appearing to be broken or damaged. The toilets are arranged in a line, with some of them being closer to the foreground and others further back in the scene. The setting is outdoors, surrounded by trees, creating a unique and unusual scene."
458255,"The image features a young girl lying in bed, reading a book. She is accompanied by a black cat, which is sitting or lying next to her. The girl is holding the book in her hands, and the cat is positioned close to her, possibly enjoying the warmth and comfort of the bed. The scene conveys a sense of relaxation and companionship between the girl and her cat."
458325,"The image depicts a busy city street filled with traffic. There are multiple cars parked on the side of the street, and a few cars are driving down the road. A skateboarder is riding down the middle of the street, surrounded by the bustling traffic.

In addition to the skateboarder, there are several pedestrians walking along the street, some of them carrying handbags. Traffic lights are visible at"
458992,"The image features a woman sitting at a dining table, enjoying a large pizza. She is holding a fork and a knife, ready to dig into the delicious meal. The pizza is placed in the center of the table, and the woman is seated on the left side of the table. The scene is set in a restaurant, with a couch visible in the background."
461009,"The image features a man sitting at a dining table, holding a small, round fruit in his hand. He is smiling, possibly enjoying the fruit or sharing a light-hearted moment with others around the table.

There are several other people in the scene, some of whom are also seated at the table. A few chairs are visible around the table, and a bowl can be seen placed on the table. The overall atmosphere appears to be"
461573,"The image features a park bench situated in the middle of a grassy area. The bench is made of metal and is placed on a concrete slab. The bench is surrounded by green grass, providing a pleasant outdoor seating area. The bench is located near a tree, adding to the serene atmosphere of the park."
463037,"The image features an old airplane parked on a grassy field. The airplane is a large, four-engine propeller plane, and it appears to be a vintage model. The plane is positioned in the middle of the field, with its wings extending outward.

There are several people in the scene, with some standing close to the airplane and others scattered around the field. The people seem to be admiring the vintage air"
464144,"The image features a man wearing a green jacket, ski goggles, and a scarf, skiing down a snowy slope. He is holding ski poles in his hands while skiing. There are several other people in the background, possibly skiing or enjoying the snowy environment. The scene is set against a beautiful snowy mountain backdrop."
464251,"The image features a red cardinal perched on a wooden ledge or fence. The bird is sitting on the edge of the fence, possibly enjoying the sunlight. The scene is set in a garden, with a potted plant nearby. The potted plant is located on the right side of the image, while the fence occupies the majority of the left side."
465129,"The image features a person, likely a woman, standing in a kitchen and holding a coffee cup. She is positioned under a light fixture, which is hanging from the ceiling. The kitchen is well-equipped with various appliances, including a refrigerator, an oven, a sink, and a microwave.

There are also several cups placed around the kitchen, as well as a bowl and a banana."
468124,"The image features a large, colorful double-decker bus parked in a grassy area. The bus is prominently displayed, occupying a significant portion of the scene. The bus is likely a tour bus, as it is parked in front of a bus stop.

In the background, there are two people visible, one closer to the left side of the image and the other further to the right. Additionally, there is a book placed on the"
470173,"The image features a statue of a woman holding a large bag on her head. The statue is positioned in the middle of a grassy area, surrounded by green grass.

In the background, there are two bicycles parked, one closer to the left side of the image and the other further to the right. Additionally, there are two benches visible in the scene, one located near the left edge of the image and the other towards the right side."
472046,"The image features a large, open kitchen with a dining table in the center. The table is set with various items, including a bowl, a pineapple, a bunch of limes, and a few oranges. There are also a couple of chairs placed around the table.

In the background, there is a living room area with a couch and a chair. A potted plant is situated near the couch, adding a touch of green"
